{
  "explicit_goal": "评估宁德时代当前是否具备买入条件",
  "implicit_needs": [
    "需要明确的买/不买判断",
    "需要买入价位、仓位、时机条件",
    "需要明确止损与证伪条件"
  ],
  "decision_context": "建仓",
  "risk_appetite_signal": "中等偏保守（用'能不能'而非'怎么重仓'）",
  "cognitive_blind_spots": [
    "可能只关注个股，忽略产业链系统性变化",
    "可能受近期走势锚定，未考虑更长周期势场",
    "可能未意识到宏观流动性约束"
  ],
  "required_depth": "标准研判",
  "temporal_focus": {
    "L2_技术": 0.2,
    "L3_情绪": 0.2,
    "L4_产业": 0.4,
    "L5_宏观": 0.2
  },
  "target": {
    "type": "个股",
    "name": "宁德时代",
    "ticker": "300750"
  }
}
